{
  "ontology": {
    "version": "v9.51",
    "entities": [
      "SourceArtifact",
      "Requirement",
      "Capability",
      "Epic",
      "UserStory",
      "AcceptanceCriterion",
      "Test",
      "Evidence",
      "Owner",
      "Decision",
      "Dependency",
      "Gap",
      "Conflict",
      "Assumption",
      "Persona",
      "Journey",
      "BudgetProfile",
      "CostEvent",
      "RoutingDecision"
    ],
    "relationships": [
      "defined_by",
      "refines",
      "implements",
      "partially_implements",
      "verified_by",
      "evidenced_by",
      "planned_by",
      "owned_by",
      "depends_on",
      "blocked_by",
      "conflicts_with",
      "supersedes",
      "derived_from",
      "invalidated_by",
      "serves_persona",
      "part_of_journey",
      "funded_by",
      "routed_by",
      "served"
    ]
  },
  "metadata": {
    "repo": "smiles70/Noni",
    "date": "2026-08-29T23:03:20.020121+00:00",
    "node_count": 77,
    "edge_count": 80,
    "graph_hash": "d51e109f4e3f"
  },
  "nodes": [
    {
      "kind": "AcceptanceCriterion",
      "id": "AC-001",
      "name": "/api/v1/billing/health reports provider=stripe, stripe_mode=live",
      "extraction_method": "rule_based",
      "confidence": 0.85
    },
    {
      "kind": "AcceptanceCriterion",
      "id": "AC-002",
      "name": "Self-purchase smoke test passes with a real card",
      "extraction_method": "rule_based",
      "confidence": 0.85
    },
    {
      "kind": "AcceptanceCriterion",
      "id": "AC-003",
      "name": "Knowledge graph schema validates against v9.51 \u00a719",
      "extraction_method": "rule_based",
      "confidence": 0.9
    },
    {
      "kind": "BudgetProfile",
      "id": "BUD-001",
      "name": "Knowledge graph rebuild budget",
      "extraction_method": "human_confirmed",
      "confidence": 0.95
    },
    {
      "kind": "Capability",
      "id": "CAP-001",
      "name": "Stripe checkout session creation",
      "extraction_method": "rule_based",
      "confidence": 0.9
    },
    {
      "kind": "Capability",
      "id": "CAP-002",
      "name": "Stripe webhook verification and idempotent processing",
      "extraction_method": "rule_based",
      "confidence": 0.9
    },
    {
      "kind": "Capability",
      "id": "CAP-003",
      "name": "Gift token issue and redemption",
      "extraction_method": "rule_based",
      "confidence": 0.85
    },
    {
      "kind": "Capability",
      "id": "CAP-004",
      "name": "Entitlement grant and revoke",
      "extraction_method": "rule_based",
      "confidence": 0.9
    },
    {
      "kind": "Capability",
      "id": "CAP-005",
      "name": "v9.51 knowledge graph extraction",
      "extraction_method": "rule_based",
      "confidence": 0.8
    },
    {
      "kind": "Capability",
      "id": "CAP-006",
      "name": "v9.51 knowledge graph validation",
      "extraction_method": "rule_based",
      "confidence": 0.8
    },
    {
      "kind": "Capability",
      "id": "CAP-007",
      "name": "Chat-initiated GitHub work item assignment",
      "extraction_method": "rule_based",
      "confidence": 0.8
    },
    {
      "kind": "Capability",
      "id": "CAP-CD-GATE",
      "name": "QA \u2192 UAT \u2192 deploy gate in deploy-staging.yml",
      "extraction_method": "rule_based",
      "confidence": 0.9
    },
    {
      "kind": "Capability",
      "id": "CAP-CD-QA",
      "name": "Pre-deploy QA agent",
      "extraction_method": "rule_based",
      "confidence": 0.9
    },
    {
      "kind": "Capability",
      "id": "CAP-CD-UAT",
      "name": "Pre-deploy UAT agent",
      "extraction_method": "rule_based",
      "confidence": 0.9
    },
    {
      "kind": "Capability",
      "id": "CAP-WI-ATTACH",
      "name": "File and screenshot attachment builder",
      "extraction_method": "rule_based",
      "confidence": 0.85
    },
    {
      "kind": "Capability",
      "id": "CAP-WI-AUTH",
      "name": "gh auth status pre-check",
      "extraction_method": "rule_based",
      "confidence": 0.9
    },
    {
      "kind": "Capability",
      "id": "CAP-WI-BOARD",
      "name": "Project board number resolver",
      "extraction_method": "rule_based",
      "confidence": 0.9
    },
    {
      "kind": "Capability",
      "id": "CAP-WI-PEOPLE",
      "name": "Chat-name to GitHub handle mapper",
      "extraction_method": "rule_based",
      "confidence": 0.9
    },
    {
      "kind": "Capability",
      "id": "CAP-WI-PERMISSION",
      "name": "Assignee repo-permission checker",
      "extraction_method": "rule_based",
      "confidence": 0.9
    },
    {
      "kind": "Capability",
      "id": "CAP-WI-REPO",
      "name": "Repository access and Issues verifier",
      "extraction_method": "rule_based",
      "confidence": 0.9
    },
    {
      "kind": "CostEvent",
      "id": "CE-001",
      "name": "Initial skill and graph creation",
      "extraction_method": "human_confirmed",
      "confidence": 0.95
    },
    {
      "kind": "Decision",
      "id": "DEC-0021",
      "name": "One-time purchase for modules 4-5, no subscriptions",
      "extraction_method": "structured_source",
      "confidence": 0.95
    },
    {
      "kind": "Decision",
      "id": "DEC-0021-PRICE",
      "name": "$39 self / $59 gift (revisable operational parameter)",
      "extraction_method": "structured_source",
      "confidence": 0.75
    },
    {
      "kind": "Dependency",
      "id": "DEP-001",
      "name": "Stripe live account and product",
      "extraction_method": "rule_based",
      "confidence": 0.95
    },
    {
      "kind": "Dependency",
      "id": "DEP-002",
      "name": "Redis broker and Celery worker",
      "extraction_method": "rule_based",
      "confidence": 0.9
    },
    {
      "kind": "Dependency",
      "id": "DEP-003",
      "name": "GitHub CLI authentication",
      "extraction_method": "rule_based",
      "confidence": 0.9
    },
    {
      "kind": "Evidence",
      "id": "EVI-001",
      "name": "Payment flow current vs target HTML diagram",
      "path": "docs/design/payment-flow-noni.html",
      "extraction_method": "rule_based",
      "confidence": 0.9
    },
    {
      "kind": "Evidence",
      "id": "EVI-002",
      "name": "Stripe live readiness intake",
      "path": ".ai/intake/2026-08-29-stripe-live-readiness-intake.md",
      "extraction_method": "rule_based",
      "confidence": 0.9
    },
    {
      "kind": "Evidence",
      "id": "EVI-003",
      "name": "v9.51 process specification",
      "path": "PROCESS_V9.51_SPEC.md",
      "extraction_method": "rule_based",
      "confidence": 0.95
    },
    {
      "kind": "Evidence",
      "id": "EVI-WI-BOARD",
      "name": "Mynaani Sprint Board project number 1",
      "path": "https://github.com/users/smiles70/projects/1",
      "extraction_method": "human_confirmed",
      "confidence": 0.95
    },
    {
      "kind": "Gap",
      "id": "GAP-001",
      "name": "Gift token lost in live Stripe redirect",
      "status": "open",
      "owner_id": "OWN-ENGINEERING",
      "next_action": "Fix PaywallPage/PurchaseSuccessPage to preserve or recover gift token after Stripe redirect",
      "extraction_method": "human_confirmed",
      "confidence": 0.95
    },
    {
      "kind": "Gap",
      "id": "GAP-002",
      "name": "Gift price never charged",
      "status": "open",
      "owner_id": "OWN-ENGINEERING",
      "next_action": "Make billing.py select stripe_price_id based on is_gift",
      "extraction_method": "human_confirmed",
      "confidence": 0.95
    },
    {
      "kind": "Gap",
      "id": "GAP-003",
      "name": "Success page shows no product details in live mode",
      "status": "open",
      "owner_id": "OWN-ENGINEERING",
      "next_action": "Lookup purchase/product from checkout session ID or pass state via server session",
      "extraction_method": "human_confirmed",
      "confidence": 0.8
    },
    {
      "kind": "Gap",
      "id": "GAP-CD-001",
      "name": "deploy-staging.yml currently has no QA/UAT gate",
      "status": "open",
      "owner_id": "OWN-DEVOPS",
      "next_action": "Add QA and UAT jobs to deploy-staging.yml",
      "extraction_method": "human_confirmed",
      "confidence": 0.95
    },
    {
      "kind": "Gap",
      "id": "GAP-WI-001",
      "name": "Work-item skill cannot be used until prerequisites are confirmed",
      "status": "resolved",
      "owner_id": "OWN-PROCESS",
      "next_action": "Board and config are in place; permission check verified",
      "extraction_method": "human_confirmed",
      "confidence": 0.95
    },
    {
      "kind": "Journey",
      "id": "JRN-FREE-TO-PAID",
      "name": "Free modules to paid modules 3-5",
      "extraction_method": "structured_source",
      "confidence": 0.95
    },
    {
      "kind": "Owner",
      "id": "OWN-DEVOPS",
      "name": "DevSecOps"
    },
    {
      "kind": "Owner",
      "id": "OWN-ENGINEERING",
      "name": "Engineering"
    },
    {
      "kind": "Owner",
      "id": "OWN-PROCESS",
      "name": "Process"
    },
    {
      "kind": "Owner",
      "id": "OWN-PRODUCT",
      "name": "Product/Owner"
    },
    {
      "kind": "Persona",
      "id": "PER-CAREGIVER",
      "name": "Adult child or caregiver purchasing access for a learner",
      "extraction_method": "structured_source",
      "confidence": 0.9
    },
    {
      "kind": "Persona",
      "id": "PER-LEARNER-55PLUS",
      "name": "Adult learner 55+ learning AI for the first time",
      "extraction_method": "structured_source",
      "confidence": 0.95
    },
    {
      "kind": "Requirement",
      "id": "REQ-001",
      "name": "No subscription or auto-renew in V1",
      "extraction_method": "structured_source",
      "confidence": 0.95
    },
    {
      "kind": "Requirement",
      "id": "REQ-002",
      "name": "Free tier resolves on a complete, dignified thought",
      "extraction_method": "structured_source",
      "confidence": 0.95
    },
    {